{
  "schema_version": "1",
  "event": "validation_complete",
  "timestamp": "2026-10-19T09:12:44.512Z",
  "repository": "my-org/my-repo",
  "issue_number": 43,
  "stellar_address": "GA5Z...KZVN",
  "result": {
    "valid": false,
    "account_funded": true,
    "trustline_exists": true,
    "xlm_balance": "10.5000000",
    "checks": [
      {
        "label": "Account funded",
        "passed": true
      },
      {
        "label": "USDC trustline",
        "passed": true
      },
      {
        "label": "XLM reserve",
        "passed": true
      },
      {
        "label": "EURC trustline (extra)",
        "passed": false
      }
    ]
  },
  "assets": [
    {
      "asset_code": "USDC",
      "asset_issuer": "GA5Z...KZVN",
      "primary": true,
      "trustline_exists": true,
      "clawback_enabled": false,
      "reason_code": "SUCCESS"
    },
    {
      "asset_code": "EURC",
      "asset_issuer": "GDHU...ARCC",
      "primary": false,
      "trustline_exists": false,
      "clawback_enabled": false,
      "reason_code": "TRUSTLINE_MISSING"
    },
    {
      "asset_code": "TOKEN",
      "asset_issuer": "CAAA...D2KM",
      "primary": false,
      "trustline_exists": true,
      "clawback_enabled": true,
      "reason_code": "CLAWBACK_BLOCKED"
    }
  ]
}
