{
  "schema_version": "1",
  "event": "validation_complete",
  "timestamp": "2024-01-15T10:30:00.000Z",
  "repository": "owner/repo",
  "issue_number": 42,
  "stellar_address": "GA5Z...KZVN",
  "result": {
    "valid": true,
    "account_funded": true,
    "trustline_exists": true,
    "xlm_balance": "10.5",
    "checks": [
      { "label": "Account funded", "passed": true },
      { "label": "USDC trustline", "passed": true }
    ]
  }
}
